ID,TITLE,YEAR,MOVIE_ID,GENRES,OVERVIEW,RUNTIME [MIN],RATING,BUDGET,REVENUE,DIRECTOR,DIRECTOR_GENDER
339,Ford v Ferrari,2019,359724,"Drama, Action, History","American car designer Carroll Shelby and the British-born driver Ken Miles work together to battle corporate interference, the laws of physics, and their own personal demons to build a revolutionary race car for Ford Motor Company and take on the dominating race cars of Enzo Ferrari at the 24 Hours of Le Mans in France in 1966.",153,8.007,97600000,225508210,James Mangold,Man
340,Forgetting Sarah Marshall,2008,9870,"Comedy, Romance, Drama","When actress Sarah Marshall dumps aspiring musician Peter Bretter for rock star Aldous Snow, Peter's world comes crashing down. His best friend Brian suggests that Peter should get away from everything and to fly off to Hawaii to escape all his problems. After arriving in Hawaii and meeting the beautiful receptionist Rachel Jansen, Peter is shocked to see not only Aldous in Hawaii, but also Sarah.",111,6.504,30000000,105173115,Nicholas Stoller,Man
341,Four Lions,2010,37495,"Comedy, Crime, Drama","Four Lions tells the story of a group of British jihadists who push their abstract dreams of glory to the breaking point. As the wheels fly off, and their competing ideologies clash, what emerges is an emotionally engaging (and entirely plausible) farce.",97,6.949,3900000,6200000,Chris Morris,Man
342,Foxcatcher,2014,87492,"Drama, Thriller",The greatest Olympic Wrestling Champion brother team joins Team Foxcatcher led by multimillionaire sponsor John E. du Pont as they train for the 1988 games in Seoul - a union that leads to unlikely circumstances.,134,6.7,24000000,12096300,Bennett Miller,Man
343,Fracture,2007,6145,Thriller,"A husband is on trial for the attempted murder of his wife, in what is seemingly an open/shut case for the ambitious district attorney trying to put him away. However, there are surprises for both around every corner, and, as a suspenseful game of cat-and-mouse is played out, each must manipulate and outwit the other.",113,7.262,10000000,91354215,Gregory Hoblit,Man
344,Frances Ha,2013,121986,"Comedy, Drama","An aspiring dancer moves to New York City and becomes caught up in a whirlwind of flighty fair-weather friends, diminishing fortunes and career setbacks.",86,7.3,0,4069826,Noah Baumbach,Man
345,Frankenweenie,2012,62214,"Animation, Comedy, Family","When a car hits young Victor's pet dog Sparky, Victor decides to bring him back to life the only way he knows how. But when the bolt-necked ""monster"" wreaks havoc and terror in the hearts of Victor's neighbors, he has to convince them that Sparky's still the good, loyal friend he was.",87,7,39000000,81493846,Tim Burton,Man
346,Fred Claus,2007,5375,"Action, Comedy, Drama","Fred Claus and Santa Claus have been estranged brothers for many years. Now Fred must reconcile his differences with his brother whom he believes overshadows him. When an efficiency expert assesses the workings at the North Pole and threatens to shut Santa down, Fred must help his brother to save Christmas.",115,5.853,100000000,97800000,David Dobkin,Man
347,Freddy vs. Jason,2003,6466,Horror,"Freddy Krueger and Jason Voorhees return to terrorize the teenagers of Elm Street. Only this time, they're out to get each other, too.",97,6.087,30000000,116643421,Ronny Yu,Man
348,Free Guy,2021,550988,"Comedy, Adventure, Science Fiction","A bank teller discovers he is actually a background player in an open-world video game, and decides to become the hero of his own story. Now, in a world where there are no limits, he is determined to be the guy who saves his world his way before it's too late.",115,7.463,110000000,331526598,Shawn Levy,Man
349,Frequency,2000,10559,"Science Fiction, Thriller, Family, Crime","When a rare phenomenon gives police officer John Sullivan the chance to speak to his father, 30 years in the past, he takes the opportunity to prevent his dad's tragic death.  After his actions inadvertently give rise to a series of brutal murders he and his father must find a way to fix the consequences of altering time.",118,7.26,31000000,68106245,Gregory Hoblit,Man
350,Fresh,2022,787752,"Horror, Thriller","Frustrated by scrolling dating apps only to end up on lame, tedious dates, Noa takes a chance by giving her number to the awkwardly charming Steve after a produce-section meet-cute at the grocery store.",114,6.97,0,0,Mimi Cave,Woman
351,Friday the 13th,2009,13207,"Horror, Thriller",A group of young adults visit a boarded up campsite named Crystal Lake where they soon encounter the mysterious Jason Voorhees and his deadly intentions.,97,5.773,19000000,91509154,Marcus Nispel,Man
352,Friends with Benefits,2011,50544,"Romance, Comedy",Dylan is done with relationships. Jamie decides to stop buying into the Hollywood clichés of true love. When the two become friends they decide to try something new and take advantage of their mutual attraction - but without any emotional attachment.,109,6.65,35000000,149500000,Will Gluck,Man
353,From Hell,2001,768,"Horror, Mystery, Thriller",Frederick Abberline is an opium-huffing inspector from Scotland Yard who falls for one of Jack the Ripper's prostitute targets in this Hughes brothers adaption of a graphic novel that posits the Ripper's true identity.,122,6.691,35000000,74558115,Albert Hughes,Man
354,Frozen,2013,109445,"Animation, Family, Adventure, Fantasy","Young princess Anna of Arendelle dreams about finding true love at her sister Elsa’s coronation. Fate takes her on a dangerous journey in an attempt to end the eternal winter that has fallen over the kingdom. She's accompanied by ice delivery man Kristoff, his reindeer Sven, and snowman Olaf. On an adventure where she will find out what friendship, courage, family, and true love really means.",102,7.2,150000000,1274219009,Jennifer Lee,Woman
355,Frozen River,2008,10183,"Drama, Crime","After her husband deserts her, working-class mother Ray Eddy is in great need of money to find a home. Lured by the possibility of easy cash, she joins Lila, a widowed Mohawk who earns a living by smuggling immigrants from Canada to the U.S. across the St. Lawrence.",97,6.6,1000000,5457664,Courtney Hunt,Woman
356,Fruitvale Station,2013,157354,Drama,"Oakland, California. Young Afro-American Oscar Grant crosses paths with family members, friends, enemies and strangers before facing his fate on the platform at Fruitvale Station, in the early morning hours of New Year's Day 2009.",82,7.356,900000,17600000,Ryan Coogler,Man
357,Funny People,2009,20829,"Comedy, Drama","Famous and wealthy funnyman George Simmons doesn't give much thought to how he treats people until a doctor delivers stunning health news, forcing George to reevaluate his priorities with a little help from aspiring stand-up comic Ira.",146,5.9,75000000,71600000,Judd Apatow,Man
358,Fury,2014,228150,"War, Drama, Action","April, 1945. As the Allies make their final push in the European Theatre, a battle-hardened army sergeant named Wardaddy commands a Sherman tank and her five-man crew on a deadly mission behind enemy lines. Outnumbered and outgunned, and with a rookie soldier thrust into their platoon, Wardaddy and his men face overwhelming odds in their heroic attempts to strike at the heart of Nazi Germany.",135,7.54,68000000,211817906,David Ayer,Man
359,G.I. Joe: The Rise of Cobra,2009,14869,"Adventure, Action, Thriller, Science Fiction","From the Egyptian desert to deep below the polar ice caps, the elite G.I. JOE team uses the latest in next-generation spy and military equipment to fight the corrupt arms dealer Destro and the growing threat of the mysterious Cobra organization to prevent them from plunging the world into chaos.",118,5.8,175000000,302500000,Stephen Sommers,Man
360,Game Night,2018,445571,"Mystery, Comedy, Crime","Max and Annie's weekly game night gets kicked up a notch when Max's brother Brooks arranges a murder mystery party -- complete with fake thugs and federal agents. So when Brooks gets kidnapped, it's all supposed to be part of the game. As the competitors set out to solve the case, they start to learn that neither the game nor Brooks are what they seem to be. The friends soon find themselves in over their heads as each twist leads to another unexpected turn over the course of one chaotic night.",100,6.85,37000000,117501013,John Francis Daley,Man
361,Gangs of New York,2002,3131,"Drama, History, Crime","In early 1860s New York, Irish immigrant Amsterdam Vallon is released from prison and returns to the Five Points, seeking revenge against his father's killer, William Cutting, a powerful anti-immigrant gang leader. He knows that revenge can only be attained by infiltrating Cutting's inner circle. Vallon's journey becomes a fight for personal survival and to find a place for the Irish people.",168,7.3,100000000,193772504,Martin Scorsese,Man
362,Garden State,2004,401,"Comedy, Drama, Romance","Andrew returns to his hometown for the funeral of his mother, a journey that reconnects him with past friends. The trip coincides with his decision to stop taking his powerful antidepressants. A chance meeting with Sam - a girl also suffering from various maladies - opens up the possibility of rekindling emotional attachments, confronting his psychologist father, and perhaps beginning a new life.",102,7.08,2500000,26781723,Zach Braff,Man
363,Gemini Man,2019,453405,"Science Fiction, Action, Adventure, Thriller","Henry Brogan is an elite 51-year-old assassin who's ready to call it quits after completing his 72nd job. His plans get turned upside down when he becomes the target of a mysterious operative who can seemingly predict his every move. To his horror, Brogan soon learns that the man who's trying to kill him is a younger, faster, cloned version of himself.",117,6.274,140000000,173469516,Ang Lee,Man
364,Geostorm,2017,274855,"Action, Science Fiction, Thriller","After an unprecedented series of natural disasters threatened the planet, the world's leaders came together to create an intricate network of satellites to control the global climate and keep everyone safe. But now, something has gone wrong: the system built to protect Earth is attacking it, and it becomes a race against the clock to uncover the real threat before a worldwide geostorm wipes out everything and everyone along with it.",109,6.117,120000000,221600160,Dean Devlin,Man
365,Get Carter,2000,10461,"Action, Drama, Thriller, Crime","Jack Carter, a mob enforcer living in Las Vegas, travels back to his hometown of Seattle for his brother's funeral. During this visit, Carter realizes that the death of his brother was not accidental, but a murder. With this knowledge, Carter sets out to kill all those responsible.",102,5.2,63600000,19412993,Stephen Kay,Man
366,Get Hard,2015,257091,Comedy,"When obscenely rich hedge-fund manager James is convicted of fraud and sentenced to a stretch in San Quentin, the judge gives him one month to get his affairs in order. Knowing that he won't survive more than a few minutes in prison on his own, James desperately turns to Darnell-- a black businessman who's never even had a parking ticket -- for help. As Darnell puts James through the wringer, both learn that they were wrong about many things, including each other.",100,6.025,40000000,111800000,Etan Cohen,Man
367,Get Him to the Greek,2010,32823,"Adventure, Comedy, Music","Pinnacle records has the perfect plan to get their sinking company back on track: a comeback concert in LA featuring Aldous Snow, a fading rockstar who has dropped off the radar in recent years. Record company intern Aaron Green is faced with the monumental task of bringing his idol, out of control rock star Aldous Snow, back to LA for his comeback show.",109,5.985,40000000,90029656,Nicholas Stoller,Man
368,Get Out,2017,419430,"Mystery, Thriller, Horror","Chris and his girlfriend Rose go upstate to visit her parents for the weekend. At first, Chris reads the family's overly accommodating behavior as nervous attempts to deal with their daughter's interracial relationship, but as the weekend progresses, a series of increasingly disturbing discoveries lead him to a truth that he never could have imagined.",104,7.621,4500000,255407969,Jordan Peele,Man
369,Get Rich or Die Tryin',2005,10060,"Drama, Crime, Music","A tale of an inner city drug dealer who turns away from crime to pursue his passion, rap music.",117,6.808,40000000,46442528,Jim Sheridan,Man
370,Ghost Rider,2007,1250,"Thriller, Action, Fantasy","In order to save his dying father, young stunt cyclist Johnny Blaze sells his soul to Mephistopheles and sadly parts from the pure-hearted Roxanne Simpson, the love of his life. Years later, Johnny's path crosses again with Roxanne, now a go-getting reporter, and also with Mephistopheles, who offers to release Johnny's soul if Johnny becomes the fabled, fiery 'Ghost Rider'.",114,5.582,110000000,228738393,Mark Steven Johnson,Man
371,Ghost Ship,2002,9645,"Horror, Mystery, Thriller","After discovering a passenger ship missing since 1962 floating adrift on the Bering Sea, salvagers claim the vessel as their own. Once they begin towing the ghost ship towards harbor, a series of bizarre occurrences happen and the group becomes trapped inside the ship, which they soon learn is inhabited by a demonic creature.",91,6,35000000,71142361,Steve Beck,Man
372,Ghost World,2001,1548,"Comedy, Drama","Two quirky, cynical teenaged girls try to figure out what to do with their lives after high school graduation. After they play a prank on an eccentric, middle aged record collector, one of them befriends him, which causes a rift in the girls’ friendship.",111,7.1,7000000,8800000,Terry Zwigoff,Man
373,Ghostbusters,2016,43074,"Action, Fantasy, Comedy","Following a ghost invasion of Manhattan, paranormal enthusiasts Erin Gilbert and Abby Yates, nuclear engineer Jillian Holtzmann, and subway worker Patty Tolan band together to stop the otherworldly threat.",117,5.351,144000000,229147509,Paul Feig,Man
374,Ginger And Rosa,2012,121872,Drama,"A look at the lives of two teenage girls - inseparable friends Ginger and Rosa -- growing up in 1960s London as the Cuban Missile Crisis looms, and the pivotal event the comes to redefine their relationship.",90,6,0,1005700,Sally Potter,Woman
375,Ginger Snaps,2001,9871,"Fantasy, Horror, Drama, Thriller","The story of two outcast sisters, Ginger and Brigitte, in the mindless suburban town of Bailey Downs. On the night of Ginger's first period, she is savagely attacked by a wild creature. Ginger's wounds miraculously heal but something is not quite right. Now Brigitte must save her sister and save herself.",108,6.911,5000000,0,John Fawcett,Man
376,Girl with a Pearl Earring,2003,3635,"Drama, Romance","This film, adapted from a work of fiction by author Tracy Chevalier, tells a story about the events surrounding the creation of the painting ""Girl With A Pearl Earring"" by 17th century Dutch master Johannes Vermeer. A young peasant maid working in the house of painter Johannes Vermeer becomes his talented assistant and the model for one of his most famous works.",101,6.621,10500000,33030115,Peter Webber,Man
377,Girls Trip,2017,417870,"Comedy, Romance, Adventure","Four girlfriends take a trip to New Orleans for an annual festival and, along the way, rediscover their wild sides and strengthen the bonds of sisterhood.",122,6.8,19000000,140376621,Malcolm D. Lee,Man
378,Gladiator,2000,98,"Action, Drama, Adventure","After the death of Emperor Marcus Aurelius, his devious son takes power and demotes Maximus, one of Rome's most capable generals who Marcus preferred. Eventually, Maximus is forced to become a gladiator and battle to the death against other men for the amusement of paying audiences.",155,8.221,103000000,465516248,Ridley Scott,Man
379,Gladiator II,2024,558449,"Action, Adventure, Drama","Years after witnessing the death of the revered hero Maximus at the hands of his uncle, Lucius is forced to enter the Colosseum after his home is conquered by the tyrannical Emperors who now lead Rome with an iron fist. With rage in his heart and the future of the Empire at stake, Lucius must look to his past to find strength and honor to return the glory of Rome to its people.",148,6.65,310000000,462180717,Ridley Scott,Man
380,Glass Onion,2022,661374,"Comedy, Crime, Mystery",World-famous detective Benoit Blanc heads to Greece to peel back the layers of a mystery surrounding a tech billionaire and his eclectic crew of friends.,140,7.038,40000000,15000000,Rian Johnson,Man
381,Glory Road,2006,9918,"Drama, History","In 1966, Texas Western coach Don Haskins led the first all-black starting line-up for a college basketball team to the NCAA national championship.",118,7.424,0,42647449,James Gartner,Man
382,Godfather,2022,863931,"Action, Drama","The sudden demise of the celebrated leader PKR leaves the ruling party in a political crisis and shakes up the family. The party has to elect a leader, and more than one player is in contention. Everyone’s intentions are blurred, and loyalties are in question. Brahma is a game changer in this squabble. Who will succeed as the leader and become the CM?",157,5.781,0,0,Mohan Raja,Man
383,Gods of Egypt,2016,205584,"Action, Adventure, Fantasy",A common thief joins a mythical god on a quest through Egypt.,127,5.69,140000000,150680864,Alex Proyas,Man
384,Godzilla,2014,124905,"Action, Drama, Science Fiction","Ford Brody, a Navy bomb expert, has just reunited with his family in San Francisco when he is forced to go to Japan to help his estranged father, Joe. Soon, both men are swept up in an escalating crisis when an ancient alpha predator arises from the sea to combat malevolent adversaries that threaten the survival of humanity. The creatures leave colossal destruction in their wake, as they make their way toward their final battleground: San Francisco.",123,6.4,160000000,524978362,Gareth Edwards,Man
385,Gone Girl,2014,210577,"Mystery, Thriller, Drama","With his wife's disappearance having become the focus of an intense media circus, a man sees the spotlight turned on him when it's suspected that he may not be innocent.",149,7.889,61000000,370890259,David Fincher,Man
386,Gone in 60 Seconds,2000,9679,"Action, Crime, Thriller","Upon learning that he has to come out of retirement to steal 50 cars in one night to save his brother Kip's life, former car thief Randall ""Memphis"" Raines enlists help from a few ""boost happy"" pals to accomplish a seemingly impossible feat. From countless car chases to relentless cops, the high-octane excitement builds as Randall swerves around more than a few roadblocks to keep Kip alive.",118,6.4,90000000,237200000,Dominic Sena,Man
387,Good Luck Chuck,2007,10030,"Comedy, Romance","Cursed since childhood, dentist Charlie Logan cannot find the right woman. Even worse, he learns that each of his ex-girlfriends finds true love with the man she meets after her relationship with him ends. Hearing of Charlie's reputation as a good-luck charm, women from all over line up for a quick tryst. But when Charlie meets the woman of his dreams, he must find a way to break the curse or risk losing her to the next man she meets.",101,5.911,25000000,59768495,Mark Helfrich,Man
388,"Good Night, and Good Luck",2005,3291,"Drama, History",The story of journalist Edward R. Murrow's stand against Senator Joseph McCarthy's anti-communist witch-hunts in the early 1950s.,92,7.076,7000000,54600000,George Clooney,Man
389,Goosebumps,2015,257445,"Adventure, Horror, Comedy","After moving to a small town, Zach Cooper finds a silver lining when he meets next door neighbor Hannah, the daughter of bestselling Goosebumps series author R.L. Stine. When Zach unintentionally unleashes real monsters from their manuscripts and they begin to terrorize the town, it’s suddenly up to Stine, Zach and Hannah to get all of them back in the books where they belong.",103,6.311,58000000,158261424,Rob Letterman,Man
390,Gothika,2003,4970,"Horror, Thriller, Mystery","After a car crash, criminal psychologist Dr. Miranda Grey regains consciousness only to find that she's a patient in the same mental institution that currently employs her. She's been accused of murdering her husband Dr. Douglas Grey — but she has no memory of committing the crime. As she tries to regain her memory and convince her co-worker, Dr. Pete Graham, of her innocence, a vengeful spirit uses her as an earthly pawn, which further convinces everyone of her guilt.",98,6.1,40000000,141591324,Mathieu Kassovitz,Man
391,Gran Torino,2008,13223,Drama,"Disgruntled Korean War veteran Walt Kowalski sets out to reform his neighbor, Thao Lor, a Hmong teenager who tried to steal Kowalski's prized possession: a 1972 Gran Torino.",116,7.989,33000000,270000000,Clint Eastwood,Man
392,Grandma,2015,309304,"Comedy, Drama","Self-described misanthrope Elle Reid has her protective bubble burst when her 18-year-old granddaughter, Sage, shows up needing help. The two of them go on a day-long journey that causes Elle to come to terms with her past and Sage to confront her future.",78,6.463,600000,7200000,Paul Weitz,Man
393,Gravity,2013,49047,"Science Fiction, Thriller, Drama","Dr. Ryan Stone, a brilliant medical engineer, is on her first Shuttle mission, with veteran astronaut Matt Kowalsky in command of his last flight before retiring. But on a seemingly routine spacewalk, disaster strikes. The Shuttle is destroyed, leaving Stone and Kowalsky completely alone-tethered to nothing but each other and spiraling out into the blackness of space. The deafening silence tells them they have lost any link to Earth and any chance for rescue. As fear turns to panic, every gulp of air eats away at what little oxygen is left. But the only way home may be to go further out into the terrifying expanse of space.",91,7.165,105000000,723192705,Alfonso Cuarón,Man
394,Green Book,2018,490132,"Drama, Comedy, History","Tony Lip, a bouncer in 1962, is hired to drive pianist Don Shirley on a tour through the Deep South in the days when African Americans, forced to find alternate accommodations and services due to segregation laws below the Mason-Dixon Line, relied on a guide called The Negro Motorist Green Book.",130,8.225,23000000,321752656,Peter Farrelly,Man
395,Green Lantern,2011,44912,"Adventure, Action, Thriller, Science Fiction","For centuries, a small but powerful force of warriors called the Green Lantern Corps has sworn to keep intergalactic order. Each Green Lantern wears a ring that grants him superpowers. But when a new enemy called Parallax threatens to destroy the balance of power in the Universe, their fate and the fate of Earth lie in the hands of the first human ever recruited.",114,5.176,200000000,219851172,Martin Campbell,Man
396,Green Room,2016,313922,"Horror, Crime, Thriller",A punk rock band is forced to fight for survival after witnessing an act of violence at a skinhead bar.,95,6.7,5000000,3800000,Jeremy Saulnier,Man
397,Green Zone,2010,22972,"War, Action, Adventure, Drama, Thriller","During the U.S.-led occupation of Baghdad in 2003, Chief Warrant Officer Roy Miller and his team of Army inspectors are dispatched to find weapons of mass destruction believed to be stockpiled in the Iraqi desert. Rocketing from one booby-trapped and treacherous site to the next, the men search for deadly chemical agents but stumble instead upon an elaborate cover-up that threatens to invert the purpose of their mission.",115,6.49,100000000,94882889,Paul Greengrass,Man
398,Greenberg,2010,27583,"Comedy, Drama, Romance","Roger Greenberg, a failed musician now making a living as a carpenter in New York, returns to Los Angeles to house-sit for his brother. He's stranded there—since he doesn't drive—until his brother's assistant, Florence, comes to his rescue. She's as much a lost soul as he is, and the pair form a significant connection—giving Roger a much-needed reason to be happy.",107,5.9,25000000,6344112,Noah Baumbach,Man
399,Grown Ups,2010,38365,Comedy,"After their high school basketball coach passes away, five good friends and former teammates reunite for a Fourth of July holiday weekend.",102,6.401,80000000,271430189,Dennis Dugan,Man
400,Guardians of the Galaxy Vol. 2,2017,283995,"Science Fiction, Adventure, Action",The Guardians must fight to keep their newfound family together as they unravel the mysteries of Peter Quill's true parentage.,137,7.612,200000000,863756051,James Gunn,Man
401,Hacksaw Ridge,2016,324786,"Drama, History, War","WWII American Army Medic Desmond T. Doss, who served during the Battle of Okinawa, refuses to kill people and becomes the first Conscientious Objector in American history to receive the Congressional Medal of Honor.",139,8.192,40000000,175302354,Mel Gibson,Man
402,"Hail, Caesar!",2016,270487,"Comedy, Crime, Drama, Mystery","When a Hollywood star mysteriously disappears in the middle of filming, the studio sends their fixer to get him back.",106,5.932,22000000,63647656,Joel Coen,Man
403,Hairspray,2007,2976,"Comedy, Romance, Drama","Pleasantly plump teenager Tracy Turnblad auditions to be on Baltimore's most popular dance show - The Corny Collins Show - and lands a prime spot. Through her newfound fame, she becomes determined to help her friends and end the racial segregation that has been a staple of the show.",117,6.7,75000000,90450008,Adam Shankman,Man
404,Hall Pass,2011,48988,"Comedy, Romance","When best buds Rick and Fred begin to show signs of restlessness at home, their wives take a bold approach to revitalize their marriages, they grant the guys a 'hall pass'—one week of freedom to do whatever they want. At first, it seems like a dream come true, but they quickly discover that their expectations of the single life—and themselves—are completely and hilariously out of sync with reality.",105,5.7,36000000,83200000,Bobby Farrelly,Man
