ID,TITLE,YEAR,MOVIE_ID,GENRES,OVERVIEW,RUNTIME [MIN],RATING,BUDGET,REVENUE,DIRECTOR,DIRECTOR_GENDER
970,The Back-Up Plan,2010,34806,"Comedy, Romance","When Zoe tires of looking for Mr. Right, she decides to have a baby on her own. But on the day she's artificially inseminated, she meets Stan, who seems to be just who she's been searching for all her life. Now, Zoe has to figure out how to make her two life's dreams fit with each other.",106,6.1,35000000,77477008,Alan Poul,Man
971,The Ballad of Buster Scruggs,2018,537996,"Western, Comedy, Drama, Music, Mystery, Romance","Vignettes weaving together the stories of six individuals in the old West at the end of the Civil War. Following the tales of a sharp-shooting songster, a wannabe bank robber, two weary traveling performers, a lone gold prospector, a woman traveling the West to an uncertain future, and a motley crew of strangers undertaking a carriage ride.",132,7.129,0,0,Joel Coen,Man
972,The Banshees of Inisherin,2022,674324,"Drama, Comedy","Two lifelong friends find themselves at an impasse when one abruptly ends their relationship, with alarming consequences for both of them.",114,7.455,20000000,49300000,Martin McDonagh,Man
973,The Batman,2022,414906,"Crime, Mystery, Thriller","In his second year of fighting crime, Batman uncovers corruption in Gotham City that connects to his own family while facing a serial killer known as the Riddler.",177,7.659,185000000,772319315,Matt Reeves,Man
974,The Beach,2000,1907,"Drama, Adventure, Romance, Thriller","Twenty-something Richard travels to Thailand and finds himself in possession of a strange map. Rumours state that it leads to a solitary beach paradise, a tropical bliss - excited and intrigued, he sets out to find it.",119,6.486,40000000,144056873,Danny Boyle,Man
975,The Beach Bum,2019,441384,"Comedy, Drama","An irreverent comedy about the misadventures of Moondog, a rebellious stoner and lovable rogue who lives large.",95,5.667,5000000,4554416,Harmony Korine,Man
976,The Beekeeper,2024,866398,"Action, Crime, Thriller",One man's campaign for vengeance takes on national stakes after he is revealed to be a former operative of a powerful and clandestine organization known as Beekeepers.,106,7.275,35000000,152720535,David Ayer,Man
977,The Beguiled,2017,399019,Drama,"During the Civil War, at a Southern girls’ boarding school, young women take in an injured enemy soldier. As they provide refuge and tend to his wounds, the house is taken over with sexual tension and dangerous rivalries, and taboos are broken in an unexpected turn of events.",93,5.92,10500000,27869129,Sofia Coppola,Woman
978,The Best Exotic Marigold Hotel,2012,74534,"Drama, Comedy","British retirees travel to India to take up residence in what they believe is a newly restored hotel. Less luxurious than its advertisements, the Marigold Hotel nevertheless slowly begins to charm in unexpected ways as the residents find new purpose in their old age.",124,7,10000000,150501815,John Madden,Man
979,The Big Short,2015,318846,"Comedy, Drama",The men who made millions from a global economic meltdown.,131,7.359,28000000,133346506,Adam McKay,Man
980,The Big Sick,2017,416477,"Comedy, Drama, Romance","Pakistan-born comedian Kumail Nanjiani and grad student Emily Gardner fall in love but struggle as their cultures clash. When Emily contracts a mysterious illness, Kumail finds himself forced to face her feisty parents, his family's expectations, and his true feelings.",120,7.3,5000000,56303596,Michael Showalter,Man
981,The Black Dahlia,2006,9676,"Crime, Thriller, Drama","In 1940s Los Angeles, two former boxers-turned-cops must grapple with corruption, narcissism, stag films and family madness as they pursue the killer of an aspiring young actress.",121,5.636,50000000,49332692,Brian De Palma,Man
982,The Blind Side,2009,22881,Drama,"The story of Michael Oher, a homeless and traumatized boy who became an All American football player and first round NFL draft pick with the help of a caring woman and her family.",129,7.673,29000000,309231694,John Lee Hancock,Man
983,The Bling Ring,2013,96936,"Drama, Crime","Inspired by actual events, a group of fame-obsessed teenagers use the Internet to track celebrities' whereabouts in order to rob their homes.",90,5.4,15000000,19145732,Sofia Coppola,Woman
984,The Book of Eli,2010,20504,"Action, Thriller, Science Fiction","A post-apocalyptic tale, in which a lone man fights his way across America in order to protect a sacred book that holds the secrets to saving humankind.",118,6.796,80000000,157107755,Allen Hughes,Man
985,The Bounty Hunter,2010,27573,"Action, Comedy, Romance","Milo Boyd, a down-on-his-luck bounty hunter, thinks he's seeing an upswing in fortune when he gets a call to bring in his bail-jumping ex-wife, a reporter named Nicole. Milo considers the job an easy payday, but Nicole quickly escapes to chase a lead on a murder case. The former spouses play an escalating game of one-upmanship, until they suddenly find themselves on the run for their lives.",110,5.9,40000000,136300000,Andy Tennant,Man
986,The Bourne Identity,2002,2501,"Action, Drama, Mystery, Thriller","Wounded to the brink of death and suffering from amnesia, Jason Bourne is rescued at sea by a fisherman. With nothing to go on but a Swiss bank account number, he starts to reconstruct his life, but finds that many people he encounters want him dead. However, Bourne realizes that he has the combat and mental skills of a world-class spy—but who does he work for?",119,7.47,60000000,214034224,Doug Liman,Man
987,The Bourne Supremacy,2004,2502,"Action, Drama, Thriller","A CIA operation to purchase classified Russian documents is blown by a rival agent, who then shows up in the sleepy seaside village where Bourne and Marie have been living. The pair run for their lives and Bourne, who promised retaliation should anyone from his former life attempt contact, is forced to once again take up his life as a trained assassin to survive.",108,7.324,75000000,288500217,Paul Greengrass,Man
988,The Bourne Ultimatum,2007,2503,"Action, Drama, Mystery, Thriller","Bourne is brought out of hiding once again by reporter Simon Ross who is trying to unveil Operation Blackbriar, an upgrade to Project Treadstone, in a series of newspaper columns. Information from the reporter stirs a new set of memories, and Bourne must finally uncover his dark past while dodging The Company's best efforts to eradicate him.",115,7.433,70000000,442824138,Paul Greengrass,Man
989,The Boxtrolls,2014,170687,"Animation, Comedy, Family, Fantasy","An orphaned boy raised by underground creatures called Boxtrolls comes up from the sewers and out of his box to save his family and the town from the evil exterminator, Archibald Snatcher.",97,6.7,60000000,108255770,Graham Annable,Man
990,The Brave One,2007,4413,"Crime, Drama, Thriller",A woman struggles to recover from a brutal attack by setting out on a mission for revenge.,122,6.6,70000000,69766619,Neil Jordan,Man
991,The Brothers Bloom,2008,21755,"Adventure, Comedy, Drama, Romance","The Brothers Bloom are the best con men in the world, swindling millionaires with complex scenarios of lust and intrigue. Now they've decided to take on one last job – showing a beautiful and eccentric heiress the time of her life with a romantic adventure that takes them around the world.",114,6.558,20000000,5530764,Rian Johnson,Man
992,The Brutalist,2024,549509,"Drama, History","When an innovative modern architect flees post-war Europe, he is given the opportunity to rebuild his legacy. Set during the dawn of the modern United States (in Pennsylvania), his wife joins him, and their lives are forever changed by a demanding, wealthy patron.",215,6.967,9600000,50145227,Brady Corbet,Man
993,The Bucket List,2007,7350,"Drama, Comedy","Corporate billionaire Edward Cole and working class mechanic Carter Chambers are worlds apart. At a crossroads in their lives, they share a hospital room and discover they have two things in common: a desire to spend the time they have left doing everything they ever wanted to do and an unrealized need to come to terms with who they are. Together they embark on the road trip of a lifetime, becoming friends along the way and learning to live life to the fullest, with insight and humor.",97,7.186,45000000,175400000,Rob Reiner,Man
994,The Butler,2013,132363,Drama,"A look at the life of Cecil Gaines, who served eight presidents as the White House's head butler from 1952 to 1986, and had a unique front-row seat as political and racial history was made.",132,7.332,25000000,177313795,Lee Daniels,Man
995,The Butterfly Effect,2004,1954,"Science Fiction, Thriller","A young man struggles to access sublimated childhood memories. He finds a technique that allows him to travel back into the past, to occupy his childhood body and change history. However, he soon finds that every change he makes has unexpected consequences.",113,7.57,13000000,96800000,J. Mackye Gruber,Man
996,The Cell,2000,8843,"Horror, Science Fiction, Thriller",A psychotherapist journeys inside a comatose serial killer in the hopes of saving his latest victim.,107,6.276,33000000,104155843,Tarsem Singh,Man
997,The Change-Up,2011,49520,Comedy,"Lifelong friends Dave and Mitch are envious of the other's life. Mitch thinks Dave has it all: a beautiful, loving family and a high-paying job at a prestigious law firm. But Dave thinks Mitch’s stress-free playboy life without obligation or consequence is the real dream come true. One fateful drunken night, they both admit that they wish they had the other’s life while peeing in a fountain when lightning strikes. The next morning, they wake up, hungover, in each other’s bodies! With time not on their side, Mitch and Dave comically struggle to avoid completely destroying each other’s lives before they can find a way to get their old ones back.",112,6.154,52000000,75500000,David Dobkin,Man
998,The Class,2008,8841,Drama,Teacher and novelist François Bégaudeau plays a version of himself as he negotiates a year with his racially mixed students from a tough Parisian neighborhood.,128,7,0,28814580,Laurent Cantet,Man
999,The Climb,2019,601493,"Adventure, Action, Drama, History","Upon learning that the international community does not recognize China's ascent of Mount Everest during May 1960 owing to a lack of videographic evidence from the summit, three members on the team rally together a group of young hopefuls to reach the world's highest point.",123,6.3,0,0,Daniel Lee,Man
1000,The Color Purple,2023,558915,Drama,"A decades-spanning tale of love and resilience and of one woman's journey to independence. Celie faces many hardships in her life, but ultimately finds extraordinary strength and hope in the unbreakable bonds of sisterhood.",141,7.021,90000000,68919191,Blitz Bazawule,Man
1001,The Conjuring,2013,138843,"Horror, Thriller","Paranormal investigators Ed and Lorraine Warren work to help a family terrorized by a dark presence in their farmhouse. Forced to confront a powerful entity, the Warrens find themselves caught in the most terrifying case of their lives.",112,7.541,13000000,321293998,James Wan,Man
1002,The Croods,2013,49519,"Animation, Adventure, Family, Comedy","The prehistoric Croods family live in a particularly dangerous moment in time. Patriarch Grug, his mate Ugga, teenage daughter Eep, son Thunk, and feisty Gran gather food by day and huddle together in a cave at night. When a more evolved caveman named Guy arrives on the scene, Grug is distrustful, but it soon becomes apparent that Guy is correct about the impending destruction of their world.",98,6.9,135000000,587204668,Kirk DeMicco,Man
1003,The Crow,2024,957452,"Action, Fantasy, Horror","Soulmates Eric and Shelly are brutally murdered when the demons of her dark past catch up with them. Given the chance to save his true love by sacrificing himself, Eric sets out to seek merciless revenge on their killers, traversing the worlds of the living and the dead to put the wrong things right.",111,5.809,50000000,24109036,Rupert Sanders,Man
1004,The Curious Case of Benjamin Button,2008,4922,"Drama, Fantasy, Romance","Born under unusual circumstances, Benjamin Button springs into being as an elderly man in a New Orleans nursing home and ages in reverse. Twelve years after his birth, he meets Daisy, a child who flits in and out of his life as she grows up to be a dancer. Though he has all sorts of unusual adventures over the course of his life, it is his relationship with Daisy, and the hope that they will come together at the right time, that drives Benjamin forward.",166,7.6,150000000,335802786,David Fincher,Man
1005,The Danish Girl,2015,306819,Drama,"When Gerda Wegener asks her husband Einar to fill in as a portrait model, Einar discovers the person she's meant to be and begins living her life as Lili Elbe. Having realized her true self and with Gerda's love and support, Lili embarks on a groundbreaking journey as a transgender pioneer.",119,7.556,15000000,64200000,Tom Hooper,Man
1006,The Darjeeling Limited,2007,4538,"Adventure, Drama, Comedy","Three American brothers who have not spoken to each other in a year set off on a train voyage across India with a plan to find themselves and bond with each other -- to become brothers again like they used to be. Their ""spiritual quest"", however, veers rapidly off-course (due to events involving over-the-counter pain killers, Indian cough syrup, and pepper spray).",92,7.153,16000000,24377151,Wes Anderson,Man
1007,The Dark Knight,2008,155,"Drama, Action, Crime, Thriller","Batman raises the stakes in his war on crime. With the help of Lt. Jim Gordon and District Attorney Harvey Dent, Batman sets out to dismantle the remaining criminal organizations that plague the streets. The partnership proves to be effective, but they soon find themselves prey to a reign of chaos unleashed by a rising criminal mastermind known to the terrified citizens of Gotham as the Joker.",152,8.525,185000000,1004558444,Christopher Nolan,Man
1008,The Dark Knight Rises,2012,49026,"Action, Crime, Drama, Thriller","Following the death of District Attorney Harvey Dent, Batman assumes responsibility for Dent's crimes to protect the late attorney's reputation and is subsequently hunted by the Gotham City Police Department. Eight years later, Batman encounters the mysterious Selina Kyle and the villainous Bane, a new terrorist leader who overwhelms Gotham's finest. The Dark Knight resurfaces to protect a city that has branded him an enemy.",165,7.8,250000000,1081041287,Christopher Nolan,Man
1009,The Dark Tower,2017,353491,"Fantasy, Action, Science Fiction",A boy haunted by visions of a parallel world aids its disillusioned guardian in preventing the destruction of the nexus of universes known as the Dark Tower.,95,5.784,60000000,113231078,Nikolaj Arcel,Man
1010,The Day After,2017,777539,,Two Secret Service agents talk to each other the day after the 2016 presidential election. One is Muslim. The other is homosexual. Colleagues. Friends. American.,15,0,0,0,Shahbaz Sarwar,Man
1011,The Day the Earth Stood Still,2008,10200,"Drama, Science Fiction, Thriller","A representative of an alien race that went through drastic evolution to survive its own climate change, Klaatu comes to Earth to assess whether humanity can prevent the environmental damage they have inflicted on their own planet. When barred from speaking to the United Nations, he decides humankind shall be exterminated so the planet can survive.",104,5.654,80000000,233093859,Scott Derrickson,Man
1012,The Death of Stalin,2017,402897,"Comedy, Drama, History","When dictator Joseph Stalin dies, his parasitic cronies square off in a frantic power struggle to become the next Soviet leader. As they bumble, brawl and back-stab their way to the top, the question remains — just who is running the government?",107,7.016,13000000,24600000,Armando Iannucci,Man
1013,The Debt,2010,48289,"Drama, Thriller","Rachel Singer is a former Mossad agent who tried to capture a notorious Nazi war criminal – the Surgeon of Birkenau – in a secret Israeli mission that ended with his death on the streets of East Berlin. Now, 30 years later, a man claiming to be the doctor has surfaced, and Rachel must return to Eastern Europe to uncover the truth. Overwhelmed by haunting memories of her younger self and her two fellow agents, the still-celebrated heroine must relive the trauma of those events and confront the debt she has incurred.",113,6.6,20000000,45636368,John Madden,Man
1014,The Departed,2006,1422,"Drama, Thriller, Crime","To take down South Boston's Irish Mafia, the police send in one of their own to infiltrate the underworld, not realizing the syndicate has done likewise. While an undercover cop curries favor with the mob kingpin, a career criminal rises through the police ranks. But both sides soon discover there's a mole among them.",151,8.159,90000000,291465000,Martin Scorsese,Man
1015,The Descendants,2011,65057,"Comedy, Drama","With his wife Elizabeth on life support after a boating accident, Hawaiian land baron Matt King takes his daughters on a trip from Oahu to Kauai to confront a young real estate broker, who was having an affair with Elizabeth before her misfortune.",115,6.836,20000000,177200000,Alexander Payne,Man
1016,The Descent,2005,9392,"Adventure, Horror","After a personal tragedy, Sarah joins her friends on a caving expedition in the Appalachian Mountains. But when a rockfall traps them deep underground, their adventure turns into a nightmare. As they search for a way out, the group discovers they are not alone—lurking in the darkness are savage, cave-dwelling creatures. With rising tension and dwindling trust, the women must fight to survive against both the predators and each other.",100,6.971,3500000,57130027,Neil Marshall,Man
1017,The Devil Wears Prada,2006,350,"Drama, Comedy","Andy moves to New York to work in the fashion industry. Her boss is extremely demanding, cruel and won't let her succeed if she doesn't fit into the high class elegant look of their magazine.",109,7.4,35000000,326706115,David Frankel,Man
1018,The Diary of a Teenage Girl,2015,250124,"Drama, Romance, Comedy","Minnie Goetze is a 15-year-old aspiring comic-book artist, coming of age in the haze of the 1970s in San Francisco. Insatiably curious about the world around her, Minnie is a pretty typical teenage girl. Oh, except that she’s sleeping with her mother’s boyfriend.",102,6.6,2000000,1477002,Marielle Heller,Woman
1019,The Disaster Artist,2017,371638,"Comedy, Drama","An aspiring actor in Hollywood meets an enigmatic stranger by the name of Tommy Wiseau, the meeting leads the actor down a path nobody could have predicted; creating the worst movie ever made.",104,7.104,10000000,29820616,James Franco,Man
1020,The Diving Bell and the Butterfly,2007,2013,"Drama, History","Jean-Dominique Bauby, editor-in-chief of French fashion bible Elle magazine, has a devastating stroke at age 43. The damage to his brain stem results in locked-in syndrome, with which he is almost completely paralyzed and only able to communicate by blinking an eye. Bauby painstakingly dictates his memoir via the only means of expression left to him.",112,7.574,14000020,19777647,Julian Schnabel,Man
1021,The Duchess,2008,12783,"Drama, History, Romance","A chronicle of the life of 18th century aristocrat Georgiana, Duchess of Devonshire, who was reviled for her extravagant political and personal life.",110,6.992,17759769,43306325,Saul Dibb,Man
1022,The Edge of Seventeen,2016,376660,"Comedy, Drama","Two high school girls are best friends until one dates the other's older brother, who is totally his sister's nemesis.",105,7.157,9000000,18803648,Kelly Fremon Craig,Woman
1023,The End of the Tour,2015,249688,Drama,"The story of the five-day interview between Rolling Stone reporter David Lipsky and acclaimed novelist David Foster Wallace, which took place right after the 1996 publication of Wallace's groundbreaking epic novel, 'Infinite Jest.'",106,7.013,0,3002884,James Ponsoldt,Man
1024,The Expendables,2010,27578,"Thriller, Adventure, Action","Barney Ross leads a band of highly skilled mercenaries including knife enthusiast Lee Christmas, a martial arts expert Yin Yang, heavy weapons specialist Hale Caesar, demolitionist Toll Road, and a loose-cannon sniper Gunner Jensen. When the group is commissioned by the mysterious Mr. Church to assassinate the dictator of a small South American island, Barney and Lee visit the remote locale to scout out their opposition and discover the true nature of the conflict engulfing the city.",103,6.249,80000000,274470394,Sylvester Stallone,Man
1025,The Fabelmans,2022,804095,Drama,"Growing up in post-World War II era Arizona, young Sammy Fabelman aspires to become a filmmaker as he reaches adolescence, but soon discovers a shattering family secret and explores how the power of films can help him see the truth.",151,7.6,40000000,45629909,Steven Spielberg,Man
1026,The Family Man,2000,5994,"Comedy, Drama, Romance, Fantasy","Jack's lavish, fast-paced lifestyle changes one Christmas night when he stumbles into a grocery store holdup and disarms the gunman. The next morning he wakes up in bed lying next to Kate, his college sweetheart he left in order to pursue his career, and to the horrifying discovery that his former life no longer exists. As he stumbles through this alternate suburban universe, Jack finds himself at a crossroad where he must choose between his high-power career and the woman he loves.",125,6.809,60000000,124700000,Brett Ratner,Man
1027,The Farewell,2019,565310,"Comedy, Drama",A headstrong Chinese-American woman returns to China when her beloved grandmother is given a terminal diagnosis. Billi struggles with her family's decision to keep grandma in the dark about her own illness as they all stage an impromptu wedding to see grandma one last time.,100,7.409,250300,23076657,Lulu Wang,Woman
1028,The Fast and the Furious,2001,9799,"Action, Crime, Thriller","Dominic Toretto is a Los Angeles street racer suspected of masterminding a series of big-rig hijackings. When undercover cop Brian O'Conner infiltrates Toretto's iconoclastic crew, he falls for Toretto's sister and must choose a side: the gang or the LAPD.",106,6.997,38000000,207283925,Rob Cohen,Man
1029,The Father,2020,600354,Drama,"A man refuses all assistance from his daughter as he ages and, as he tries to make sense of his changing circumstances, he begins to doubt his loved ones, his own mind and even the fabric of his reality.",97,8.097,6000000,21029340,Florian Zeller,Man
1030,The Fault in Our Stars,2014,222935,"Romance, Drama","Despite the tumor-shrinking medical miracle that has bought her a few years, Hazel has never been anything but terminal, her final chapter inscribed upon diagnosis. But when a patient named Augustus Waters suddenly appears at Cancer Kid Support Group, Hazel's story is about to be completely rewritten.",126,7.595,14000000,307166834,Josh Boone,Man
1031,The Favourite,2018,375262,"History, Comedy, Drama","England, early 18th century. The close relationship between Queen Anne and Sarah Churchill is threatened by the arrival of Sarah's cousin, Abigail Hill, resulting in a bitter rivalry between the two cousins to be the Queen's favourite.",120,7.498,15000000,95918706,Yorgos Lanthimos,Man
1032,The Fighter,2009,63599,Drama,"Following the tragic death of his beloved wife, a retired underground brawler named Leone (Rafael Amaya) returns to the world of illegal street fighting in a desperate bid to help capture ""El Chapo,"" the fearsome head of the powerful criminal underworld. In order to break from his past, Leone will have to embrace it one last time. But surviving long enough to find redemption won't be easy for Leone, because his old boss has vowed revenge, and the authorities are determined to take away his freedom.",90,2,500000,0,Javier Barbera,Man
1033,The Florida Project,2017,394117,Drama,"The story of a precocious six year-old and her ragtag group of friends whose summer break is filled with childhood wonder, possibility and a sense of adventure while the adults around them struggle with hard times.",112,7.428,2000000,11303040,Sean Baker,Man
1034,The Fog,2005,791,"Horror, Mystery","Trapped within an eerie mist, the residents of Antonio Bay have become the unwitting victims of a horrifying vengeance. One hundred years earlier, a ship carrying lepers was purposely lured onto the rocky coastline and sank, drowning all aboard. Now they're back – long-dead mariners who've waited a century for their revenge.",100,4.556,18000000,46201432,Rupert Wainwright,Man
1035,The Fountain,2006,1381,"Drama, Adventure, Science Fiction, Romance","Spanning over one thousand years, and three parallel stories, The Fountain is a story of love, death, spirituality, and the fragility of our existence in this world.",96,6.899,35000000,15304890,Darren Aronofsky,Man
1036,The Fourth Kind,2009,22824,"Mystery, Science Fiction, Thriller","Since the 1960s, a disproportionate number of the population in and around Nome, Alaska, have gone missing. Despite FBI investigations, the disappearances remain a mystery. Dr. Abigail Tyler, a psychologist, may be on the verge of blowing the unsolved cases wide open when, during the course of treating her patients, she finds evidence of alien abductions.",98,6.339,10000000,47709193,Olatunde Osunsanmi,Man
1037,The French Dispatch,2021,542178,"Drama, Comedy","The staff of an American magazine based in France puts out its last issue, with stories featuring an artist sentenced to life imprisonment, student riots, and a kidnapping resolved by a chef.",108,7,25000000,46333545,Wes Anderson,Man
