ID,TITLE,YEAR,MOVIE_ID,GENRES,OVERVIEW,RUNTIME [MIN],RATING,BUDGET,REVENUE,DIRECTOR,DIRECTOR_GENDER
690,Nightcrawler,2014,242582,"Crime, Drama, Thriller","When Lou Bloom, desperate for work, muscles into the world of L.A. crime journalism, he blurs the line between observer and participant to become the star of his own story. Aiding him in his effort is Nina, a TV-news veteran.",118,7.7,8500000,47425835,Dan Gilroy,Man
691,Nightmare Alley,2021,597208,"Crime, Drama, Thriller",An ambitious carnival man with a talent for manipulating people with a few well-chosen words hooks up with a female psychologist who is even more dangerous than he is.,151,6.968,60000000,39629195,Guillermo del Toro,Man
692,Nine,2009,10197,"Drama, Music, Romance","Arrogant, self-centered movie director Guido Contini finds himself struggling to find meaning, purpose, and a script for his latest film endeavor. With only a week left before shooting begins, he desperately searches for answers and inspiration from his wife, his mistress, his muse, and his mother.",118,5.5,80000000,53825515,Rob Marshall,Man
693,Ninja Assassin,2009,22832,"Action, Adventure, Thriller","Ninja Assassin follows Raizo, one of the deadliest assassins in the world. Taken from the streets as a child, he was transformed into a trained killer by the Ozunu Clan, a secret society whose very existence is considered a myth. But haunted by the merciless execution of his friend by the Clan, Raizo breaks free from them and vanishes. Now he waits, preparing to exact his revenge.",99,6.676,40000000,61601280,James McTeigue,Man
694,No Country for Old Men,2007,6977,"Crime, Thriller, Western","Llewelyn Moss stumbles upon dead bodies, $2 million and a hoard of heroin in a Texas desert, but methodical killer Anton Chigurh comes looking for it, with local sheriff Ed Tom Bell hot on his trail. The roles of prey and predator blur as the violent pursuit of money and justice collide.",122,7.947,25000000,171627166,Joel Coen,Man
695,No Hard Feelings,2023,884605,"Comedy, Romance","On the brink of losing her childhood home, Maddie discovers an intriguing job listing: wealthy helicopter parents looking for someone to “date” their introverted 19-year-old son, Percy, before he leaves for college. To her surprise, Maddie soon discovers the awkward Percy is no sure thing.",104,6.7,45000000,83000000,Gene Stupnitsky,Man
696,No One Will Save You,2023,820609,"Horror, Science Fiction",A lonely woman battles extraterrestrials who threaten her future while forcing her to face her past.,93,6.682,22800000,0,Brian Duffield,Man
697,No Strings Attached,2011,41630,"Comedy, Romance","Emma is a busy doctor who sets up a seemingly perfect arrangement when she offers her best friend Adam a relationship with one rule: No strings attached. But when a fling becomes a thing, can sex friends stay best friends?",107,6.298,25000000,149200000,Ivan Reitman,Man
698,No Time to Die,2021,370172,"Action, Thriller, Adventure","Bond has left active service and is enjoying a tranquil life in Jamaica. His peace is short-lived when his old friend Felix Leiter from the CIA turns up asking for help. The mission to rescue a kidnapped scientist turns out to be far more treacherous than expected, leading Bond onto the trail of a mysterious villain armed with dangerous new technology.",163,7.355,250000000,774153024,Cary Joji Fukunaga,Man
699,Noah,2014,86834,"Drama, Adventure",A man who suffers visions of an apocalyptic deluge takes measures to protect his family from the coming flood.,138,5.67,125000000,362600000,Darren Aronofsky,Man
700,Nomadland,2021,581734,Drama,"A woman in her sixties embarks on a journey through the western United States after losing everything in the Great Recession, living as a van-dwelling modern-day nomad.",108,7.183,5000000,39458207,Chloé Zhao,Woman
701,Nope,2022,762504,"Horror, Science Fiction","Residents in a lonely gulch of inland California bear witness to an uncanny, chilling discovery.",130,6.828,68000000,170823080,Jordan Peele,Man
702,Norbit,2007,9757,Comedy,"A mild-mannered guy who is engaged to a monstrous woman meets the woman of his dreams, and schemes to find a way to be with her.",102,5.678,10000000,159814490,Brian Robbins,Man
703,Norway,2014,285554,"Horror, Comedy, Fantasy","In 1984, photophobic Zano arrives in Athens and quickly gets devoured by the dark underbelly of the capital city.",73,5,0,0,Yannis Veslemes,Man
704,Nosferatu,2024,426063,"Horror, Fantasy","A gothic tale of obsession between a haunted young woman and the terrifying vampire infatuated with her, causing untold horror in its wake.",133,6.691,50000000,181764515,Robert Eggers,Man
705,Notorious,2009,14410,"Music, Drama, History","""Notorious"" is the story of Christopher Wallace. Through raw talent and sheer determination, Wallace transforms himself from Brooklyn street hustler (once selling crack to pregnant women) to one of the greatest rappers of all time: The Notorious B.I.G. Follow his meteoric rise to fame and his refusal to succumb to expectations - redefining our notion of ""The American Dream.""",122,6.939,0,43051547,George Tillman Jr.,Man
706,Novitiate,2017,411976,Drama,"In the early 1960s, during the Vatican II era, a young woman training to become a nun struggles with issues of faith, sexuality and the changing church.",123,6.4,0,580346,Margaret Betts,Woman
707,Now You See Me,2013,75656,"Thriller, Crime",An FBI agent and an Interpol detective track a team of illusionists who pull off bank heists during their performances and reward their audiences with the money.,116,7.333,75000000,351723989,Louis Leterrier,Man
708,Nowhere Boy,2009,33511,Drama,"A rebellious teenager, future Beatle John Lennon lives with his Aunt Mimi in working-class mid-1950s Liverpool, England. Mimi's husband suddenly dies, and John spies his mother Julia at the funeral. Despite Mimi's misgivings, John intends to have a real relationship with his mother. Julia introduces him to popular music and the banjo and, though a family conflict looms, young John is inspired to form his own band.",98,7.166,1500000,6577779,Sam Taylor-Johnson,Woman
709,Nurse Betty,2000,10480,"Comedy, Crime, Thriller, Drama, Romance","What happens when a person decides that life is merely a state of mind? If you're Betty, a small-town waitress and soap opera fan from Fair Oaks, Kansas, you refuse to believe that you can't be with the love of your life just because he doesn't really exist. After all, life is no excuse for not living. Traumatized by a savage event, Betty enters into a fugue state that allows -- even encourages -- her to keep functioning... in a kind of alternate reality.",108,6.061,24000000,29364989,Neil LaBute,Man
710,"O Brother, Where Art Thou",2000,134,"Adventure, Comedy, Crime","In the deep south during the 1930s, three escaped convicts search for hidden treasure while a relentless lawman pursues them.",107,7.32,26000000,71877090,Joel Coen,Man
711,Oblivion,2013,75612,"Action, Science Fiction, Adventure, Mystery","Jack Harper is one of the last few drone repairmen stationed on Earth. Part of a massive operation to extract vital resources after decades of war with a terrifying threat known as the Scavs, Jack’s mission is nearly complete. His existence is brought crashing down when he rescues a beautiful  stranger from a downed spacecraft. Her arrival triggers a chain of events that  forces him to question everything he knows and puts the fate of humanity in his hands.",124,6.664,120000000,286168572,Joseph Kosinski,Man
712,Observe and Report,2009,16991,"Comedy, Crime, Drama","Mall security guard Ronnie Barnhardt is called into action to stop a flasher from turning shopper's paradise into his personal peep show. But when Barnhardt can't bring the culprit to justice, a surly police detective is recruited to close the case.",86,5.428,18000000,24007324,Jody Hill,Man
713,Obsessed,2009,17335,"Drama, Thriller","Things couldn't be better for Derek Charles. He's just received a big promotion at work, and has a wonderful marriage with his beautiful wife, Sharon. However, into this idyllic world steps Lisa, a temporary worker at Derek's office. Lisa begins to stalk Derek, jeopardizing all he holds dear.",108,5.754,20000000,73830340,Steve Shill,Man
714,Ocean's Eleven,2001,161,"Thriller, Crime","Less than 24 hours into his parole, charismatic thief Danny Ocean is already rolling out his next plan: In one night, Danny's hand-picked crew of specialists will attempt to steal more than $150 million from three Las Vegas casinos. But to score the cash, Danny risks his chances of reconciling with ex-wife, Tess.",116,7.452,85000000,450717150,Steven Soderbergh,Man
715,Ocean's Twelve,2004,163,"Thriller, Crime","Despite pulling off one of the biggest heists in Las Vegas history and splitting the $160 million take, each of the infamous Ocean's crew have tried to go straight, lay low and live a legit life ... but that's proven to be a challenge. Casino owner Terry Benedict demands that Danny Ocean return the money, plus millions more in interest. Unable to come up the cash, the crew is forced to come together to pull off another series of heists, this time in Rome, Paris, and Amsterdam – but a Europol agent is hot on their heels.",125,6.564,110000000,362744280,Steven Soderbergh,Man
716,Oldboy,2003,670,"Drama, Thriller, Mystery, Action","With no clue how he came to be imprisoned, drugged and tortured for 15 years, a desperate man seeks revenge on his captors.",120,8.246,3000000,17500000,Park Chan-wook,Man
717,Olympus Has Fallen,2013,117263,"Action, Thriller","When the White House (Secret Service Code: ""Olympus"") is captured by a terrorist mastermind and the President is kidnapped, disgraced former Presidential guard Mike Banning finds himself trapped within the building. As the national security team scrambles to respond, they are forced to rely on Banning's inside knowledge to help retake the White House, save the President and avert an even bigger disaster.",120,6.413,70000000,170270201,Antoine Fuqua,Man
718,On the Basis of Sex,2018,339380,"Drama, History",Young lawyer Ruth Bader Ginsburg teams with her husband Marty to bring a groundbreaking case before the U.S. Court of Appeals and overturn a century of sex discrimination.,120,7.343,20000000,38755968,Mimi Leder,Woman
719,Once Upon a Time in Mexico,2003,1428,"Action, Crime, Thriller",A corrupt CIA agent Sands hires hitman El Mariachi to assassinate a Mexican general hired by a drug kingpin attempting a coup d'état of the President of Mexico.,102,6.296,29000000,98769390,Robert Rodriguez,Man
720,One Night in Miami...,2020,661914,Drama,"In the aftermath of Cassius Clay's defeat of Sonny Liston in 1964, the boxer meets with Malcolm X, Sam Cooke and Jim Brown to change the course of history in the segregated South.",114,7.023,0,0,Regina King,Woman
721,Only God Forgives,2013,77987,"Drama, Thriller, Crime","Julian, who runs a Thai boxing club as a front organization for his family's drug smuggling operation, is forced by his mother Crystal to find and kill the individual responsible for his brother's recent death.",90,5.8,4800000,10300000,Nicolas Winding Refn,Man
722,Only Lovers Left Alive,2013,152603,"Drama, Romance, Fantasy","A depressed musician reunites with his lover. However, their romance, already played over several centuries, is disrupted by the arrival of her uncontrollable younger sister.",123,7.204,7000000,8213623,Jim Jarmusch,Man
723,Onward,2020,508439,"Family, Comedy, Adventure, Animation, Fantasy","In a suburban fantasy world, two teenage elf brothers embark on an extraordinary quest to discover if there is still a little magic left out there.",102,7.653,200000000,141888276,Dan Scanlon,Man
724,Oppenheimer,2023,872585,"Drama, History",The story of J. Robert Oppenheimer's role in the development of the atomic bomb during World War II.,181,8.045,100000000,952000000,Christopher Nolan,Man
725,Origin,2023,753336,Drama,"While investigating the global phenomenon of caste and its dark influence on society, a journalist faces unfathomable personal loss and uncovers the beauty of human resilience.",141,6.631,38000000,4474931,Ava DuVernay,Woman
726,Orphan,2009,21208,"Horror, Thriller","After losing their baby, a married couple adopt 9-year old Esther, who may not be as innocent as she seems.",122,7,20000000,77912251,Jaume Collet-Serra,Man
727,Ouija,2014,242512,Horror,A group of friends must confront their most terrifying fears when they awaken the dark powers of an ancient spirit board.,89,5.148,5000000,103600000,Stiles White,Man
728,Overboard,2018,454619,"Romance, Comedy","A spoiled, wealthy yacht owner is thrown overboard and becomes the target of revenge from his mistreated employee.",112,6.654,12000000,91244913,Rob Greenberg,Man
729,PK,2014,297222,"Comedy, Drama, Science Fiction","A stranger in the city asks questions no one has asked before. Known only by his initials, the man's innocent questions and childlike curiosity take him on a journey of love, laughter and letting go.",153,7.7,13000000,118920000,Rajkumar Hirani,Man
730,Pacific Rim,2013,68726,"Action, Science Fiction, Adventure","Using massive piloted robots to combat the alien threat, earth's survivors take the fight to the invading alien force lurking in the depths of the Pacific Ocean. Nearly defenseless in the face of the relentless enemy, the forces of mankind have no choice but to turn to two unlikely heroes who now stand as earth's final hope against the mounting apocalypse.",131,6.916,180000000,411000000,Guillermo del Toro,Man
731,Pain and Glory,2019,519010,Drama,"Salvador Mallo, a filmmaker in the twilight of his career, remembers his life: his mother, his lovers, the actors he worked with. The sixties in a small village in Valencia, the eighties in Madrid, the present, when he feels an immeasurable emptiness, facing his mortality, the incapability of continuing filming, the impossibility of separating creation from his own life. The need of narrating his past can be his salvation.",114,7.38,10769016,37359689,Pedro Almodóvar,Man
732,Palm Springs,2020,587792,"Comedy, Romance, Science Fiction","When carefree Nyles and reluctant maid of honor Sarah have a chance encounter at a Palm Springs wedding, things get complicated when they find themselves unable to escape the venue, themselves, or each other.",90,7.333,5000000,1818417,Max Barbakow,Man
733,Pan,2015,266647,"Fantasy, Adventure, Family, Action","Living a bleak existence at a London orphanage, 12-year-old Peter finds himself whisked away to the fantastical world of Neverland. Adventure awaits as he meets new friend James Hook and the warrior Tiger Lily. They must band together to save Neverland from the ruthless pirate Blackbeard. Along the way, the rebellious and mischievous boy discovers his true destiny, becoming the hero forever known as Peter Pan.",111,5.959,150000000,128388320,Joe Wright,Man
734,Pan's Labyrinth,2006,1417,"Fantasy, Drama, War","In post–civil war Spain, 10-year-old Ofelia moves with her pregnant mother to live under the control of her cruel stepfather. Drawn into a mysterious labyrinth, she meets a faun who reveals that she may be a lost princess from an underground kingdom. To return to her true father, she must complete a series of surreal and perilous tasks that blur the line between reality and fantasy.",118,7.758,19000000,83258226,Guillermo del Toro,Man
735,Panic Room,2002,4547,"Crime, Drama, Thriller","Trapped in their New York brownstone's panic room, a hidden chamber built as a sanctuary in the event of break-ins, newly divorced Meg Altman and her young daughter Sarah play a deadly game of cat-and-mouse with three intruders - Burnham, Raoul and Junior - during a brutal home invasion. But the room itself is the focal point because what the intruders really want is inside it.",111,6.793,48000000,197100000,David Fincher,Man
736,ParaNorman,2012,77174,"Family, Animation, Adventure, Comedy","In the town of Blithe Hollow, Norman Babcock can speak to the dead, but no one other than his eccentric new friend believes his ability is real. One day, Norman's eccentric uncle tells him of a ritual he must perform to protect the town from a curse cast by a witch centuries ago.",93,7.018,60000000,107307220,Sam Fell,Man
737,Parallel Mothers,2021,766798,Drama,"Two unmarried women who have become pregnant by accident and are about to give birth meet in a hospital room: Janis, in her late-thirties, unrepentant and happy; Ana, a teenager, remorseful and frightened.",123,6.801,0,23099858,Pedro Almodóvar,Man
738,Parasite,2019,496243,"Comedy, Thriller, Drama","All unemployed, Ki-taek's family takes peculiar interest in the wealthy and glamorous Parks for their livelihood until they get entangled in an unexpected incident.",133,8.496,11363000,257591776,Bong Joon Ho,Man
739,Pariah,2011,73939,Drama,"A Brooklyn teenager juggles conflicting identities and risks friendship, heartbreak, and family in a desperate search for sexual expression.",86,6.8,500000,769552,Dee Rees,Woman
740,Passengers,2016,274870,"Drama, Romance, Science Fiction","A spacecraft traveling to a distant colony planet and transporting thousands of people has a malfunction in its sleep chambers. As a result, two passengers are awakened 90 years early.",116,6.952,110000000,303144152,Morten Tyldum,Man
741,Passing,2021,541524,Drama,"In 1920s New York City, a Black woman finds her world upended when her life becomes intertwined with a former childhood friend who's passing as white.",98,6.3,0,0,Rebecca Hall,Woman
742,Past Lives,2023,666277,"Drama, Romance","After decades apart, childhood friends Nora and Hae Sung are reunited in New York for one fateful weekend as they confront notions of destiny, love, and the choices that make a life.",106,7.7,12000000,28126646,Celine Song,Woman
743,Paul,2011,39513,"Adventure, Comedy, Science Fiction","For the past 60 years, a space-traveling smart-ass named Paul has been locked up in a top-secret military base, advising world leaders about his kind. But when he worries he’s outlived his usefulness and the dissection table is drawing uncomfortably close, Paul escapes on the first RV that passes by his compound in Area 51. Fortunately, it contains the two earthlings who are most likely to rescue and harbor an alien on the run.",104,6.734,40000000,98000000,Greg Mottola,Man
744,Pearl Harbor,2001,676,"War, Romance, History, Action","The lifelong friendship between Rafe McCawley and Danny Walker is put to the ultimate test when the two ace fighter pilots become entangled in a love triangle with beautiful Naval nurse Evelyn Johnson. But the rivalry between the friends-turned-foes is immediately put on hold when they find themselves at the center of Japan's devastating attack on Pearl Harbor on Dec. 7, 1941.",183,6.9,140000000,449220945,Michael Bay,Man
745,Pet Sematary,2019,157433,Horror,"Dr. Louis Creed and his wife, Rachel, move from Boston to Ludlow, in rural Maine, with their two young children. Hidden in the woods near the new family home, Ellie, their eldest daughter, discovers a mysterious cemetery where the pets of community members are buried.",100,5.744,21000000,113118226,Dennis Widmyer,Man
746,Phantom Thread,2017,400617,"Drama, Romance","In 1950s London, a renowned dressmaker's meticulous lifestyle begins drastically changing as his relationship with his young muse intensifies.",130,7.31,35000000,47756590,Paul Thomas Anderson,Man
747,Philomena,2013,205220,Drama,"A woman searches for her adult son, who was taken away from her decades ago when she was forced to live in a convent.",98,7.343,12000000,100100000,Stephen Frears,Man
748,Phone Booth,2003,1817,"Thriller, Crime","A slick New York publicist who picks up a ringing receiver in a phone booth is told that if he hangs up, he'll be killed... and the little red light from a laser rifle sight is proof that the caller isn't kidding.",81,6.858,13000000,97837138,Joel Schumacher,Man
749,Pineapple Express,2008,10189,"Action, Comedy, Crime",A stoner and his dealer are forced to go on the run from the police after the pothead witnesses a cop commit a murder.,111,6.642,27000000,101624843,David Gordon Green,Man
750,Pirates of the Caribbean Dead Man's Chest,2006,58,"Adventure, Fantasy, Action","Captain Jack Sparrow races to recover the heart of Davy Jones to avoid enslaving his soul to Jones' service, as other friends and foes seek the heart for their own agenda as well.",151,7.373,200000000,1066179747,Gore Verbinski,Man
751,Pirates of the Caribbean Dead Men Tell No Tales,2017,166426,"Adventure, Action, Fantasy","Thrust into an all-new adventure, a down-on-his-luck Capt. Jack Sparrow feels the winds of ill-fortune blowing even more strongly when deadly ghost sailors led by his old nemesis, the evil Capt. Salazar, escape from the Devil's Triangle. Jack's only hope of survival lies in seeking out the legendary Trident of Poseidon, but to find it, he must forge an uneasy alliance with a brilliant and beautiful astronomer and a headstrong young man in the British navy.",129,6.654,230000000,795922298,Espen Sandberg,Man
752,Pirates of the Caribbean On Stranger Tides,2011,1865,"Adventure, Action, Fantasy","Captain Jack Sparrow crosses paths with a woman from his past, and he's not sure if it's love — or if she's a ruthless con artist who's using him to find the fabled Fountain of Youth. When she forces him aboard the Queen Anne's Revenge, the ship of the formidable pirate Blackbeard, Jack finds himself on an unexpected adventure in which he doesn't know who to fear more: Blackbeard or the woman from his past.",136,6.564,379000000,1046721266,Rob Marshall,Man
753,Pirates of the Caribbean The Curse of the Black Pearl,2003,22,"Adventure, Fantasy, Action","After Port Royal is attacked and pillaged by a mysterious pirate crew, capturing the governor's daughter Elizabeth Swann in the process, William Turner asks free-willing pirate Jack Sparrow to help him locate the crew's ship—The Black Pearl—so that he can rescue the woman he loves.",143,7.816,140000000,655011224,Gore Verbinski,Man
754,Pitch Black,2000,2787,"Thriller, Science Fiction, Action","When their ship crash-lands on a remote planet, the marooned passengers soon learn that escaped convict Riddick isn't the only thing they have to fear. Deadly creatures lurk in the shadows, waiting to attack in the dark, and the planet is rapidly plunging into the utter blackness of a total eclipse. With the body count rising, the doomed survivors are forced to turn to Riddick with his eerie eyes to guide them through the darkness to safety. With time running out, there's only one rule: Stay in the light.",108,6.9,23000000,53187659,David Twohy,Man
755,Pitch Perfect,2012,114150,"Comedy, Music, Romance","College student Beca knows she does not want to be part of a clique, but that's exactly where she finds herself after arriving at her new school. Thrust in among mean gals, nice gals and just plain weird gals, Beca finds that the only thing they have in common is how well they sing together. She takes the women of the group out of their comfort zone of traditional arrangements and into a world of amazing harmonic combinations in a fight to the top of college music competitions.",112,7.3,17000000,115647426,Jason Moore,Man
756,Pitch Perfect 2,2015,254470,"Comedy, Music","The Bellas are back, and they are better than ever. After being humiliated in front of none other than the President of the United States of America, the Bellas are taken out of the Aca-Circuit. In order to clear their name, and regain their status, the Bellas take on a seemingly impossible task: winning an international competition no American team has ever won. In order to accomplish this monumental task, they need to strengthen the bonds of friendship and sisterhood and blow away the competition with their amazing aca-magic! With all new friends and old rivals tagging along for the trip, the Bellas can hopefully accomplish their dreams.",115,6.8,29000000,287144079,Elizabeth Banks,Woman
757,Pixels,2015,257344,"Action, Comedy, Science Fiction, Fantasy",Video game experts are recruited by the military to fight 1980s-era video game characters who've attacked New York.,106,5.761,88000000,244874809,Chris Columbus,Man
758,Planet 51,2009,16866,"Animation, Family, Comedy, Science Fiction, Adventure","When Earth astronaut Capt. Chuck Baker arrives on Planet 51 -- a world reminiscent of American suburbia circa 1950 -- he tries to avoid capture, recover his spaceship and make it home safely, all with the help of an empathetic little green being.",91,5.9,70000000,104945765,Jorge Blanco,Man
759,Playback,2019,884252,,"Andrea settles in at an Airbnb out of town, to record coachwhip snake sounds. Once in the woods, she hears a strange gagging who she soon discovers is her Airbnb host. It's part of her process. Intrigued, she gets obsessed with the sound which leads to a terrifying climax.",0,0,0,0,Nikhail Asnani,Man
760,Please Give,2010,40247,"Comedy, Drama","In New York City, a husband and wife butt heads with the granddaughters of the elderly woman who lives in the apartment the couple owns.",90,6.2,3000000,0,Nicole Holofcener,Woman
761,Point Break,2015,257088,"Action, Adventure, Crime, Thriller","A young undercover FBI agent infiltrates a gang of thieves who share a common interest in extreme sports. A remake of the 1991 film, ""Point Break"".",114,5.955,105000000,133782481,Ericson Core,Man
762,Poltergeist,2015,243688,Horror,"A family's suburban home is invaded by angry spirits. When the terrifying apparitions escalate their attacks and take the youngest daughter, the family must come together to rescue her.",93,5.221,35000000,95682614,Gil Kenan,Man
