ID,TITLE,YEAR,MOVIE_ID,GENRES,OVERVIEW,RUNTIME [MIN],RATING,BUDGET,REVENUE,DIRECTOR,DIRECTOR_GENDER
0,"10,000 BC",2008,7840,"Adventure, Action, Drama, Fantasy",A prehistoric epic that follows a young mammoth hunter's journey through uncharted territory to secure the future of his tribe.,109,5.501,105000000,269784201,Roland Emmerich,Man
1,12 Strong,2018,429351,"War, Drama, Action, History",A team of special forces head into Afghanistan in the aftermath of the September 11th attacks in an attempt to dismantle the Taliban.,130,6.347,35000000,67450815,Nicolai Fuglsig,Man
2,12 Years a Slave,2013,76203,"Drama, History","In the pre-Civil War United States, Solomon Northup, a free black man from upstate New York, is abducted and sold into slavery. Facing cruelty as well as unexpected kindnesses Solomon struggles not only to stay alive, but to retain his dignity. In the twelfth year of his unforgettable odyssey, Solomon’s chance meeting with a Canadian abolitionist will forever alter his life.",134,7.936,20000000,187000000,Steve McQueen,Man
3,127 Hours,2010,44115,"Adventure, Drama, Thriller",The true story of mountain climber Aron Ralston's remarkable adventure to save himself after a fallen boulder crashes on his arm and traps him in an isolated canyon in Utah.,94,7.085,18000000,35700000,Danny Boyle,Man
4,1408,2007,3021,"Horror, Mystery","A man who specializes in debunking paranormal occurrences checks into the fabled room 1408 in the Dolphin Hotel. Soon after settling in, he confronts genuine terror.",104,6.695,25000000,133000000,Mikael Håfström,Man
5,15 Minutes,2001,2749,"Action, Crime, Thriller","When Eastern European criminals Oleg and Emil come to New York City to pick up their share of a heist score, Oleg steals a video camera and starts filming their activities, both legal and illegal. When they learn how the American media circus can make a remorseless killer look like the victim and make them rich, they target media-savvy NYPD Homicide Detective Eddie Flemming and media-naive FDNY Fire Marshal Jordy Warsaw, the cops investigating their murder and torching of their former criminal partner, filming everything to sell to the local tabloid TV show ""Top Story.""",120,5.895,60000000,56359980,John Herzfeld,Man
6,16 Blocks,2006,2207,"Action, Adventure, Crime, Thriller","An aging cop is assigned the ordinary task of escorting a fast-talking witness from police custody to a courthouse, but they find themselves running the gauntlet as other forces try to prevent them from getting there.",105,6.448,55000000,65664721,Richard Donner,Man
7,17 Again,2009,16996,"Comedy, Fantasy, Drama, Romance","On the brink of a midlife crisis, 30-something Mike O'Donnell wishes he could have a ""do-over."" And that's exactly what he gets when he wakes up one morning to find he's 17 years old again. With his adult mind stuck inside the body of a teenager, Mike actually has the chance to reverse some decisions he wishes he'd never made. But maybe they weren't so bad after all.",102,6.313,20000000,136300000,Burr Steers,Man
8,1917,2019,530915,"War, History, Drama, Action","At the height of the First World War, two young British soldiers must cross enemy territory and deliver a message that will stop a deadly attack on hundreds of soldiers.",119,7.986,100000000,446064352,Sam Mendes,Man
9,2 Fast 2 Furious,2003,584,"Action, Crime, Thriller","It's a major double-cross when former police officer Brian O'Conner teams up with his ex-con buddy Roman Pearce to transport a shipment of ""dirty"" money for shady Miami-based import-export dealer Carter Verone. But the guys are actually working with undercover agent Monica Fuentes to bring Verone down.",107,6.511,76000000,236350661,John Singleton,Man
10,2012,2009,14161,"Action, Adventure, Science Fiction","Dr. Adrian Helmsley, part of a worldwide geophysical team investigating the effect on the earth of radiation from unprecedented solar storms, learns that the earth's core is heating up. He warns U.S. President Thomas Wilson that the crust of the earth is becoming unstable and that without proper preparations for saving a fraction of the world's population, the entire race is doomed. Meanwhile, writer Jackson Curtis stumbles on the same information. While the world's leaders race to build ""arks"" to escape the impending cataclysm, Curtis struggles to find a way to save his family. Meanwhile, volcanic eruptions and earthquakes of unprecedented strength wreak havoc around the world.",158,5.864,200000000,791217826,Roland Emmerich,Man
11,20th Century Girl,2022,851644,"Romance, Drama","In 1999, a teen girl keeps close tabs on a boy in school on behalf of her deeply smitten best friend – then she gets swept up in a love story of her own.",119,8.148,119,0,Bang Woo-ri,Woman
12,20th Century Women,2016,342737,Drama,"In 1979 Santa Barbara, California, Dorothea Fields is a determined single mother in her mid-50s who is raising her adolescent son, Jamie, at a moment brimming with cultural change and rebellion. Dorothea enlists the help of two younger women – Abbie, a free-spirited punk artist living as a boarder in the Fields' home and Julie, a savvy and provocative teenage neighbour – to help with Jamie's upbringing.",118,7.31,7000000,5664764,Mike Mills,Man
13,21 Jump Street,2012,64688,"Action, Comedy, Crime","When cops Schmidt and Jenko join the secret Jump Street unit, they use their youthful appearances to go undercover as high school students. They trade in their guns and badges for backpacks, and set out to shut down a dangerous drug ring. But, as time goes on, Schmidt and Jenko discover that high school is nothing like it was just a few years earlier -- and, what's more, they must again confront the teenage terror and anxiety they thought they had left behind.",109,6.883,42000000,201585328,Phil Lord,Man
14,22 Jump Street,2014,187017,"Crime, Comedy, Action","After making their way through high school (twice), big changes are in store for officers Schmidt and Jenko when they go deep undercover at a local college. But when Jenko meets a kindred spirit on the football team, and Schmidt infiltrates the bohemian art major scene, they begin to question their partnership. Now they don't have to just crack the case - they have to figure out if they can have a mature relationship. If these two overgrown adolescents can grow from freshmen into real men, college might be the best thing that ever happened to them.",112,6.83,50000000,331333876,Phil Lord,Man
15,25th Hour,2002,1429,"Crime, Drama","In New York City in the days following the events of 9/11, Monty Brogan is a convicted drug dealer about to start a seven-year prison sentence, and his final hours of freedom are devoted to hanging out with his closest buddies and trying to prepare his girlfriend for his extended absence.",135,7.319,5000000,23932055,Spike Lee,Man
16,28 Days,2000,10468,"Comedy, Drama","After getting into a car accident while drunk on the day of her sister's wedding, Gwen Cummings is given a choice between prison or a rehab center. She chooses rehab, but is extremely resistant to taking part in any of the treatment programs they have to offer, refusing to admit that she has an alcohol addiction.",103,6.156,43000000,62198945,Betty Thomas,Woman
17,28 Days Later,2002,170,"Horror, Thriller, Science Fiction","Twenty-eight days after a killer virus was accidentally unleashed from a British research facility, a small group of London survivors are caught in a desperate struggle to protect themselves from the infected. Carried by animals and humans, the virus turns those it infects into homicidal maniacs -- and it's absolutely impossible to contain.",113,7.234,8000000,85032676,Danny Boyle,Man
18,28 Weeks Later,2007,1562,"Horror, Thriller, Science Fiction","Twenty-eight weeks after the spread of a deadly rage virus, the inhabitants of the British Isles have lost their battle against the onslaught, as the virus has killed everyone there. Six months later, a group of Americans dare to set foot on the Isles, convinced the danger has passed. But it soon becomes all too clear that the scourge continues to live, waiting to pounce on its next victims.",100,6.607,15000000,72304846,Juan Carlos Fresnadillo,Man
19,30 Days of Night,2007,4513,"Horror, Thriller","This is the story of an isolated Alaskan town that is plunged into darkness for a month each year when the sun sinks below the horizon. As the last rays of light fade, the town is attacked by a bloodthirsty gang of vampires bent on an uninterrupted orgy of destruction. Only the small town's husband-and-wife Sheriff team stand between the survivors and certain destruction.",113,6.436,30000000,80276156,David Slade,Man
20,42,2013,109410,Drama,"In 1947, Jackie Robinson becomes the first Black man to play in Major League Baseball facing unabashed racism from the public, the press and other players.",128,7.2,40000000,95020213,Brian Helgeland,Man
21,47 Ronin,2013,64686,"Drama, Action, Fantasy","Kai—an outcast—joins Oishi, the leader of 47 outcast samurai.  Together they seek vengeance upon the treacherous overlord who killed their master and banished their kind.  To restore honour to their homeland, the warriors embark upon a quest that challenges them with a series of trials that would destroy ordinary warriors.",119,6.201,175000000,151783839,Carl Rinsch,Man
22,500 Days of Summer,2009,19913,"Comedy, Drama, Romance","Tom, greeting-card writer and hopeless romantic, is caught completely off-guard when his girlfriend, Summer, suddenly dumps him. He reflects on their 500 days together to try to figure out where their love affair went sour, and in doing so, Tom rediscovers his true passions in life.",95,7.298,7500000,60781545,Marc Webb,Man
23,8 Mile,2002,65,"Drama, Music","For Jimmy Smith, Jr., life is a daily fight just to keep hope alive. Feeding his dreams in Detroit's vibrant music scene, Jimmy wages an extraordinary personal struggle to find his own voice - and earn a place in a world where rhymes rule, legends are born and every moment… is another chance.",111,7.143,41000000,242875078,Curtis Hanson,Man
24,9,2009,12244,"Action, Adventure, Animation, Science Fiction, Thriller","When 9 first comes to life, he finds himself in a post-apocalyptic world. All humans are gone, and it is only by chance that he discovers a small community of others like him taking refuge from fearsome machines that roam the earth intent on their extinction. Despite being the neophyte of the group, 9 convinces the others that hiding will do them no good.",79,6.939,30000000,48428063,Shane Acker,Man
25,99 Homes,2015,283235,Drama,"After his family is evicted from their home, proud and desperate construction worker Dennis Nash tries to win his home back by striking a deal with the devil and working for Rick Carver, the corrupt real estate broker who evicted him.",112,6.8,8000000,1411927,Ramin Bahrani,Man
26,A Beautiful Day in the Neighborhood,2019,501907,"Drama, History, Family","An award-winning cynical journalist, Lloyd Vogel, begrudgingly accepts an assignment to write an Esquire profile piece on the beloved television icon Fred Rogers. After his encounter with Rogers, Vogel's perspective on life is transformed.",109,6.954,25000000,67900000,Marielle Heller,Woman
27,A Beautiful Mind,2001,453,"Drama, Romance","From the heights of notoriety to the depths of depravity, John Forbes Nash Jr. experiences it all. As a brilliant but socially awkward mathematician, he made a groundbreaking discovery early in his career and stands on the brink of international acclaim. But as the handsome and arrogant Nash accepts secret work in cryptography, he becomes entangled in a mysterious conspiracy. His life takes a nightmarish turn and he soon finds himself on a painful and harrowing journey of self-discovery.",135,7.9,58000000,316791257,Ron Howard,Man
28,A Christmas Carol,2009,17979,"Animation, Family, Fantasy, Drama","Miser Ebenezer Scrooge is awakened on Christmas Eve by spirits who reveal to him his own miserable existence, what opportunities he wasted in his youth, his current cruelties, and the dire fate that awaits him if he does not change his ways. Scrooge is faced with his own story of growing bitterness and meanness, and must decide what his own future will hold: death or redemption.",96,6.897,200000000,325286646,Robert Zemeckis,Man
29,A Complete Unknown,2024,661539,"Drama, Music","New York, early 1960s. Against the backdrop of a vibrant music scene and tumultuous cultural upheaval, an enigmatic 19-year-old from Minnesota arrives in the West Village with his guitar and revolutionary talent, destined to change the course of American music.",140,7.104,65000000,138003641,James Mangold,Man
30,A Fantastic Woman,2017,429191,Drama,"Marina's life is thrown into turmoil following the death of her partner. Mourning the loss of the man she loved, she finds herself under intense scrutiny from those with no regard for her privacy.",104,7.017,0,1880736,Sebastián Lelio,Man
31,A Good Year,2006,9726,"Comedy, Drama, Romance","Failed London banker Max Skinner inherits his uncle's vineyard in Provence, where he spent many childhood holidays. Upon his arrival, he meets a woman from California who tells Max she is his long-lost cousin and that the property is hers.",117,6.666,35000000,42064105,Ridley Scott,Man
32,A Haunting in Venice,2023,945729,"Mystery, Thriller, Crime","Celebrated sleuth Hercule Poirot, now retired and living in self-imposed exile in Venice, reluctantly attends a Halloween séance at a decaying, haunted palazzo. When one of the guests is murdered, the detective is thrust into a sinister world of shadows and secrets.",104,6.586,60000000,121400000,Kenneth Branagh,Man
33,A Hidden Life,2019,403300,"History, Drama, War",Austrian farmer Franz Jägerstätter faces the threat of execution for refusing to fight for the Nazis during World War II.,173,7.2,9000000,4645140,Terrence Malick,Man
34,A History of Violence,2005,59,"Drama, Thriller, Crime",An average family is thrust into the spotlight after the father commits a seemingly self-defense murder at his diner.,96,7.157,32000000,61477797,David Cronenberg,Man
35,A Man Called Otto,2022,937278,"Comedy, Drama","When a lively young family moves in next door, grumpy widower Otto Anderson meets his match in a quick-witted, pregnant woman named Marisol, leading to an unlikely friendship that turns his world upside down.",126,7.757,50000000,108961677,Marc Forster,Man
36,A Monster Calls,2016,258230,"Fantasy, Adventure, Family",12-year-old Conor encounters an ancient tree monster who proceeds to help him cope with his mother's terminal illness and being bullied in school.,108,7.288,43000000,47309313,J.A. Bayona,Man
37,A Most Violent Year,2014,241239,"Crime, Drama, Thriller","A thriller set in New York City during the winter of 1981, statistically one of the most violent years in the city's history, and centered on the lives of an immigrant and his family trying to expand their business and capitalize on opportunities as the rampant violence, decay, and corruption of the day drag them in and threaten to destroy all they have built.",124,6.607,20000000,12007070,J.C. Chandor,Man
38,A Nightmare on Elm Street,2010,23437,"Horror, Mystery, Thriller","Teenagers Nancy, Quentin, Kris, Jesse and Dean are all neighborhood friends who begin having the same dream of a horribly disfigured man who wears a tattered sweater and a glove made of knives. The man terrorizes them in their dreams, and the only escape is to wake up. But when, one by one, they start dying violently, the friends realize that what happens in the dream world is real, and the only way to stay alive is to stay awake.",95,5.532,35000000,115665418,Samuel Bayer,Man
39,A Quiet Place,2018,447332,"Horror, Drama, Science Fiction",A family is forced to live in silence while hiding from creatures that hunt by sound.,91,7.396,17000000,340955294,John Krasinski,Man
40,A Real Pain,2024,1013850,"Comedy, Drama",Mismatched cousins David and Benji reunite for a tour through Poland to honor their beloved grandmother. The adventure takes a turn when the pair's old tensions resurface against the backdrop of their family history.,90,6.763,3000000,24856027,Jesse Eisenberg,Man
41,A Separation,2011,60243,Drama,A married couple are faced with a difficult decision - to improve the life of their child by moving to another country or to stay in Iran and look after a deteriorating parent who has Alzheimer's disease.,123,7.894,5000000,24426169,Asghar Farhadi,Man
42,A Serious Man,2009,12573,"Comedy, Drama","It is 1967, and Larry Gopnik, a physics professor at a quiet Midwestern university, has just been informed by his wife Judith that she is leaving him. She has fallen in love with one of his more pompous acquaintances Sy Ableman.",106,6.7,7000000,31400000,Ethan Coen,Man
43,A Simple Favor,2018,484247,"Thriller, Comedy, Mystery","Stephanie, a dedicated mother and popular vlogger, befriends Emily, a mysterious upper-class woman whose son Nicky attends the same school as Miles, Stephanie's son. When Emily asks her to pick Nicky up from school and then disappears, Stephanie undertakes an investigation that will dive deep into Emily's cloudy past.",117,6.639,20000000,97644617,Paul Feig,Man
44,A Star Is Born,2018,332562,"Music, Drama, Romance","Seasoned musician Jackson Maine discovers — and falls in love with — struggling artist Ally. She has just about given up on her dream to make it big as a singer — until Jack coaxes her into the spotlight. But even as Ally's career takes off, the personal side of their relationship is breaking down, as Jack fights an ongoing battle with his own internal demons.",136,7.5,36000000,436388866,Bradley Cooper,Man
45,A Walk to Remember,2002,10229,"Drama, Romance","When the popular, restless Landon Carter is forced to participate in the school drama production, he falls in love with Jamie Sullivan, the daughter of the town's minister. Jamie has a ""to-do"" list for her life, as well as a very big secret she must keep from Landon.",101,7.756,11800000,47494916,Adam Shankman,Man
46,Abduction,2011,59965,"Thriller, Action, Mystery","For many years, Nathan Harper has had the uneasy feeling that life with his family isn't quite what it seems. As he draws closer to uncovering the truth, he is hunted by assassins, forcing him to flee with his neighbor, Karen, the only person he can trust.",106,5.851,35000000,82087155,John Singleton,Man
47,About Schmidt,2002,2755,"Drama, Comedy","A recently retired man embarks on a journey to his estranged daughter's wedding, only to discover more about himself and life than he ever expected.",125,6.839,30000000,105834556,Alexander Payne,Man
48,Abraham Lincoln: Vampire Hunter,2012,72331,"Action, Fantasy, Horror","President Lincoln's mother is killed by a supernatural creature, which fuels his passion to crush vampires and their slave-owning helpers.",105,5.763,69000000,116500000,Timur Bekmambetov,Man
49,Ad Astra,2019,419704,"Science Fiction, Drama","The near future, a time when both hope and hardships drive humanity to look to the stars and beyond. While a mysterious phenomenon menaces to destroy life on planet Earth, astronaut Roy McBride undertakes a mission across the immensity of space and its many perils to uncover the truth about a lost expedition that decades before boldly faced emptiness and silence in search of the unknown.",123,6.1,87500000,127461872,James Gray,Man
50,Adaptation.,2002,2757,"Comedy, Crime, Drama","Charlie Kaufman is a confused L.A. screenwriter overwhelmed by feelings of inadequacy, sexual frustration, self-loathing, and by the screenwriting ambitions of his freeloading twin brother Donald. While struggling to adapt ""The Orchid Thief,"" by Susan Orlean, Kaufman's life spins from pathetic to bizarre. The lives of Kaufman, Orlean's book, become strangely intertwined as each one's search for passion collides with the others'.",115,7.345,19000000,32800000,Spike Jonze,Man
51,Adventureland,2009,16614,"Comedy, Drama, Romance","In the summer of 1987, a college graduate takes a 'nowhere' job at his local amusement park, only to find it's the perfect course to get him prepared for the real world.",107,6.399,9800000,17200000,Greg Mottola,Man
52,After.Life,2009,36419,"Drama, Horror, Mystery, Thriller","Following a terrible car crash, a woman awakes to find an enigmatic mortician preparing her for burial.",104,6.329,4500000,3606395,Agnieszka Wojtowicz-Vosloo,Woman
53,Aftershock,2010,44560,Drama,"Tangshan, 1976. Two seven-year-old twins are buried under the rubble of the deadliest earthquake of the 20th century. The rescue team explains to their mother that freeing either child will almost certainly result in the death of the other. Forced to make the most difficult decision of her life, she finally chooses to save her son. Though left behind as dead, the little girl miraculously survives, unbeknownst to her brother and mother.",135,7.1,25000000,100297064,Feng Xiaogang,Man
54,Aftersun,2022,965150,Drama,Sophie reflects on the shared joy and private melancholy of a holiday she took with her father twenty years earlier. Memories fill the gaps between camcorder footages as she tries to reconcile the father she knew with the troubled man she didn't.,101,7.675,0,7834405,Charlotte Wells,Woman
55,Air,2023,964980,"Drama, History",Discover the game-changing partnership between a then undiscovered Michael Jordan and Nike's fledgling basketball division which revolutionized the world of sports and culture with the Air Jordan brand.,111,7.3,80000000,90100000,Ben Affleck,Man
56,Aladdin,2019,420817,"Adventure, Fantasy, Romance, Family",A kindhearted street urchin named Aladdin embarks on a magical adventure after finding a lamp that releases a wisecracking genie while a power-hungry Grand Vizier vies for the same lamp that has the power to make their deepest wishes come true.,127,7.093,183000000,1097831681,Guy Ritchie,Man
57,Alfie,2004,8849,"Comedy, Drama, Romance",A tale of a philosophical womanizer who is forced to question his seemingly carefree existence.,106,5.842,60000000,35060882,Charles Shyer,Man
58,Ali,2001,8489,Drama,"In 1964, a brash, new pro boxer, fresh from his Olympic gold medal victory, explodes onto the scene: Cassius Clay. Bold and outspoken, he cuts an entirely new image for African Americans in sport with his proud public self-confidence and his unapologetic belief that he is the greatest boxer of all time. Yet at the top of his game, both Ali's personal and professional lives face the ultimate test.",157,6.76,107000000,87812729,Michael Mann,Man
59,Alice in Wonderland,2010,12155,"Family, Fantasy, Adventure","Alice, now 19 years old, returns to the whimsical world she first entered as a child and embarks on a journey to discover her true destiny.",108,6.6,200000000,1025467110,Tim Burton,Man
60,Alien vs. Predator,2004,395,"Adventure, Science Fiction, Action, Horror","When scientists discover something near Antarctica that appears to be a buried Pyramid, they send a research team out to investigate. Little do they know that they are about to step into a hunting ground where Aliens are grown as sport for the Predator race.",101,5.946,70000000,177427090,Paul W. S. Anderson,Man
61,Alien: Covenant,2017,126889,"Horror, Science Fiction, Thriller","The crew of the colony ship Covenant, bound for a remote planet on the far side of the galaxy, discovers what they think is an uncharted paradise but is actually a dark, dangerous world.",122,6.164,97000000,240891763,Ridley Scott,Man
62,All Quiet on the Western Front,2022,49046,"War, History, Drama","Paul Baumer and his friends Albert and Muller, egged on by romantic dreams of heroism, voluntarily enlist in the German army. Full of excitement and patriotic fervour, the boys enthusiastically march into a war they believe in. But once on the Western Front, they discover the soul-destroying horror of World War I.",147,7.722,20000000,0,Edward Berger,Man
63,All of Us Strangers,2023,994108,"Romance, Drama, Fantasy","One night in his near-empty tower block in contemporary London, Adam has a chance encounter with a mysterious neighbor Harry, which punctures the rhythm of his everyday life.",105,7.411,5000000,14864960,Andrew Haigh,Man
64,All the Money in the World,2017,446791,"Crime, History, Thriller",The story of the kidnapping of 16-year-old John Paul Getty III and the desperate attempt by his devoted mother to convince his billionaire grandfather Jean Paul Getty to pay the ransom.,132,6.48,50000000,56996304,Ridley Scott,Man
65,Almost Famous,2000,786,"Drama, Music","In 1973, 15-year-old William Miller's unabashed love of music and aspiration to become a rock journalist lands him an assignment from Rolling Stone magazine to interview and tour with the up-and-coming band, Stillwater.",124,7.498,60000000,47386287,Cameron Crowe,Man
66,Ambulance,2022,763285,"Thriller, Action, Crime","Decorated veteran Will Sharp, desperate for money to cover his wife's medical bills, asks for help from his adoptive brother Danny. A charismatic career criminal, Danny instead offers him a score: the biggest bank heist in Los Angeles history: $32 million.",136,6.637,40000000,52303589,Michael Bay,Man
67,American Fiction,2023,1056360,"Comedy, Drama","A novelist fed up with the establishment profiting from ""Black"" entertainment uses a pen name to write a book that propels him into the heart of hypocrisy and the madness he claims to disdain.",117,7.283,16000000,22483370,Cord Jefferson,Man
68,American Gangster,2007,4982,"Drama, Crime","Loosely based on the criminal career of Frank Lucas, a gangster from La Grange, North Carolina, who smuggled heroin into the United States on American service planes returning from the Vietnam War, before being detained by a task force led by Newark Detective Richie Roberts.",157,7.591,100000000,269755430,Ridley Scott,Man
